label,title,content
1,One of the best,"This CD is so good words are hard to come by to describe it. Ricky Van Shelton's voice is perfect for Gospel music and the song choice's on this recording are great. I bought this from Amazon with the hope that because Van Shelton was singing it, that it would be good. I was not disappointed. This CD is great."
1,Not Just Another Rap CD,"I bought this CD because of one song-""What Would You Do"". This is definately the BEST song on the album. The message is sad b/c it talks about a mother who has to work as a prostitute to feed her son, but I absolutely love it. The rest of the album is ok, but What Would You Do is the deepest song on here. As well as ""Sista"". I don't like rap music that much but City High is different."
0,Hmmm when is the full saga coming George !!,"It's alaways the same, we,ve been waiting years for this to come out and when it does you think to yourself, shall i buy it..I have decided not to, not because i'm not a fan of Star Wars, it's because i'm fed up with, all the film companies releasing colections only to replace them with another special edition anniversary etc etc edition.I know that Mr Lucas is going to put all 6 films in one super collection and when he does you can be sure thats the one I will buy, so people stand up to these people who keep bringing out different and better versions lets just keep it sensible.P.S Bet the collection is in time for Christmas LOL !!!"
0,"Without Owen Wilson, There Would Be One Star","If you choose to rent and watch this, rent a hammer as well. First, smash the DVD of this to oblivion and then whack yourself on your bean several times for being such a knob. Dumbness, lameness, lousy acting mixed with a lousy plot and marginal purpose to OK computer generated action sequences. Whap yourself again if you ever think of this terrible movie again. The good stuff of this movie would make a total of an amusing four minute YouTube video with cowboy Owen Wilson and the Roman general bickering. That is it. Don't make me break out my own hammer... Move on. Bad, bad, bad movie."
0,Disappointing wix filter,The filter had less pleats(18) compared to my old Fram air filter(30). More pleats means more surface area for filtering the air. The rubber around the edges were loose and didn't form a proper seal.
0,Bad quality USB speakerphone,This is a USB speakerphone of the worst quality I've ever seen. The sound quality is bad. My partner can hardly hear what I said. It is not the loudness but the echo. I will not recommend this speakerphone to anyone.
1,lots o fun,"This Game is lots of fun. I bought it to play with my family over the X-mass holiday. The only down side is that the cards don't say what they do on them, you have to look them up in the book which comes with the game. This makes for slow game play at first. However, there are 2 different versions of this game available, and the collectors edition has printed what the cards do right on the cards, plus the art work on the cards is much nicer. I highly recommend getting the collectors edition, it's worth the extra couple of bucks."
0,funny indeed,"Wrote Joe Nye : ""Alexa led me to the bed in the middle of the enormous room and pulled me down beside her. I kissed her breasts and ran my hand between her thighs. She gripped my shoulders tightly. Unlike the first time I made love to Alexa, when the ecstasy had been eroded by a sense of anxiety and uncertainty, I was sucked into this moment as quickly and completely as if I had placed my feet in quicksand. Memories from years ago blended with intense physical excitement in a driving, pounding torrent of passion.""Ridicule does not kill, but it can definitely lighten up your day!"
0,Are you kidding me?,"This movie was abysmal. I don't understand how anyone could possibly rate it over two stars. The acting was ridiculous, it is amazing that Robert Duvall lent his name to the film. The cinematography was terrible. The plot also seemed thoughtless, although, having not read the book, I cannot attest to its faithfulness. It seemed as though the producers spent the movie's entire budget on payroll, as the props, writing, etc. were all very shabby. Overall, it is hard to even watch the movie all the way through."
1,Healing The Wounded emotions,Good all round book for the doctor or counsellor looking at non pharmacological means to tacklean immense problem in society today.Also some key spiritual truths as emotions are intimatelylinked to the human spirit.
1,The Heart of All Youngs Music,"This has to be the Neil Young album to savour. Known as on of the ""roughest"" of all youngs albums, with that said, this is the best by far of Youngs early recordings. Songs such as L.A., and Last Dance, will leave you loving this rare gem. This is the cornerstone of all Youngs collection, left for you to love over and over again!!!! You aren't a Young fan until you have heard or loved this album."
0,Dumbest game in THE WORLD!!!!!! :-(,"This is the dumbest game ever, no questions asked. I thought Sega would do a better job for a game like this! Let me explain my experience:Well, first of all, I rented this game (good thing too) and I came home excited to play it because I'm really into monsters, and creating and customizing stuff. Well so I played it and I hated it. That's all there is to be said about ""Stupid, stupid, stupid Amazing Island!!!!!"" It's a good thing I only rented it, because I almost wanted to buy it before I knew what it was like. :-( DON'T RENT OR BUY IT! DON'T PLAY IT, PERIOD!"
0,It's going back!,I orderd this lens a few days ago and I am not keeping it. Here is my reviewPros:* Solid build quality* Fast and quiet autofocus* Well controlled Barrel Distortion even at 17mm.Cons:* After testing this lens for 2 hours. 95% of the pictures were comming out dark with some indoor pictures having dark corners even with my flash on. Picture taken at 2pm on a bright sunny day were dark and colors were dull!!!*My other L lens EF 70-200 f 4 (from 4 years ago) takes amazing picture compared to this one.ConclusionI think this is quality assurance issue. We are in bad economical times and Canon is getting cheap.Now I have to spend $20 to send it back...I am thinking that I am much better off walking into a store and paying the extra bucks and test the lens before buying it...or get a used one from 4 to 5 years ago. In otherwords treat any lens produced in the last 2 years like a Sigma lens test it before you buy it
1,Great workout,"ORDER THIS!! I was introduced to Minna after after seeing and doing a brief workout with the Fitness/Exercise On Demand Channel. After doing this routine a few times, I soon ordered the DVD and haven't been disappointed. It is an incredibly wonderful workout for fat burning. The added Bonus 15 minute training for abs really hits the spot (ouch! in a good way). I especially liked the Grace and Balance portion. Minna is concise and uplifting in that she provides a different type of cardio workout. The routine is not boring and very doable. You can start out slower if you need to and work your way up to her speed (which is what I did). I am very happy I ordered this DVD and you will too."
0,Do not buy this,"My first unit lasted about 5 months, and I had it replaced under warranty costing me about $40 or so in shipping costs and about a month's time. The replacement lasted about a year before it just suddently stopped working. The unit is quiet, so I didn't notice that it quit working until I saw the temp was at 81. I wonder how long it was out before I noticed? Customer service has yet to respond to my inquiry - it's been about a week now. Bad product is matched by bad customer service."
1,Nice Iron,"I bought this iron about two years ago. I'm forever leaving water in it, even when it's off. Big mistake as it spits water, as well as the heating element doesn't work properly. Irons aren't made to take this abuse, and now I have to get another. However, I'll buy another just like this as I love the titanium finish on the soleplate. I can't tell you how many times I've used fusible fabric, and it never stuck! Much better than any non-stick surface I've used. Wish I could get the iron repaired, as everything else works fine."
0,Not exactly symmetrical,"I would return this if I could. I thought this would have been a terrific razor considering the reviews. However, after a few months of use and switching blades (again, switching) I have noticed that one side shows more blade than the other...hence one side of the shave is ""closer"". Not sure what to do."
0,Dissapointing.,"The word that I frist heard describing Kelly's new Album was edgey, and if by edgey you mean full of annoying guitar melody's then it is very edgey. The lyrics are fine, but they would have worked so much better if they were put the good music. Like I said the lead guitar is just overwhelming and annoying. Kelly Clarkson is famous because she is an amazing singer, and I don't want to hear her overshadowed with guitar melodies and overproduced background beats."
1,Sugar Artistry!,"Wanted this book for several years--Gave up owning this book, due to being out of print with an extremely high resale price ($99.00 plus). Now that it is more reasonable - so I am now a very proud owner! This is a great addition to my collection of her books. She was my first ""idol""!"
1,Great toddler book,"My 21-month-old son adores this book. The illustrations are bright and cheerful. The story has fun sounds to make, and he learns to count throughout the book. A wonderful toddler book."
0,Product still faulty in 2008,"My husband bought me this tool in 2008 and it has the same fly-apart head construction that other reviewers describe. Mine even broke a window. The tool is so non-functional that I don't see how B&D could have put it on the market. They clearly didn't test it themselves. When it isn't flying apart, it consumes cutting line as if it were spaghetti. I would NOT buy another string trimmer from Black and Decker."
0,salt leaks out of the bottom,I purchased these salt and pepper shakers because they looked nice. They don't hold a lot of salt or pepper and the salt leaks out of the bottom. This was a bad purchase. I would not recommend them to anyone.
0,Poorly made,"I got this doll for my 3 year old grandson, while he was playing with it, the very first day we got it, his leg snapped off. The joint broke completely, and he was not playing rough with it...just carrying it around, by the head no less. He tried to take the mask off and...*SNAP* the leg came off."
0,She's Lost Her Keen Eye,"This is perhaps the fourth book by Ann Tyler that I have read and I realized after completing it, I continue to look for and hope for the bite, the razzle-dazzle keen eye she had for the human condition found in her earlier work.Alas, it isn't in The Amateur Marriage. This book has a cast of completely forgetable and unlikable characters, mundane plotlines and conflict, and no real developmental arc to any of them. If this is her subtle metaphor for life and marriage, well, thanks, but that's not my experience and that's certainly not why I shell out 25 bucks to read fiction! I like real life portrayed presented through the language of a gifted wordsmith--someone who can take ""ordinary"" and hold it up as extaordinary--she's done that before! Life's too short and I'll probably not waste another minute of it wading through another Anne Tyler novel."
0,"Adequate, eventually","This tripod is easy to setup for hands-free shower usage, but the nozzle hangs too low for stand-up showers. In part because I've hacked in a much better shower head for the Zodi hose that hangs even lower, I also had to hack an extension for the upright to get the entire rig to hang just above my head (I'm 5'10; thankfully my shower hut is 7' :). If you need to raise the curved piece, a piece of 3/4"" white PVC tubing slides right over the tubes with enough support for the top piece and the shower head, without throwing off the tripod balance too badly.Also, on first assembly, we found how poorly the curved piece at the top was welded to the supporting upright; it came off in my hands with very little pressure applied (the other reason why the PVC sleeve became necessary; I have no welding facilities, and didn't think solder would be as strong as I needed.)It looks good in principle, but the low height and cheap manufacture work against it in my books."
0,Season two Sucks in Japanese Audio........,"Like I said in my review of the season one box set......DON'T BUY IT, IT IS NOT WORTH THE MONEY!!!!!!!!!Update: Reported by ICv2 in April 2010, Toei is now offering all 200 episodes refurbished of the series for internatioal soliction( I don't know if they included the two specials and the three movies though(please have someone answer that part)). Sorry it came so late."
1,Good Study Bible,"Very good study Bible. McCarthur is very diligent in studying the Bible and all types of resources surrounding it such as history, Greek, Hebrew, other Christian works, secular works, etc. Not a big fan of NASB or NKJV of the Bible, though many prefer them. In some cases the reading is more difficult. For example (NASB then KJV) magi-wise men, dissipation-riot, sordid-filthy, diadems-crowns. Obviously there are examples where the opposite is true also. Another place to look at some NASB changes is hissheep.org. A good, understandable KJV non-study Bible is the Defined King James Bible by Bibles for Today. Hardcovers are reasonably priced. Anyway the McCarthur Bible is a good and informative study Bible."
0,Zzzzzz,I could not get interested and eventually gave up. There are too many good books to read without wAsting time on this.
0,Moon Pool and cave diving,"I bought this book without very high expectations, because it was apparently published originally as a mass-market paperback. But I'd been told it had a hi-tech cave-diving theme, and it did turn out to mention several cave-divers I know. (But the scene is really a flooded mine.) It's not a mystery; you find out whodunit on the first page of the first chapter. I guess it's a suspense thriller. I found it readable, but the author's inclusion of lots of unnecessary facts in an effort to show off his research skills did get a bit tiresome. The author is better at technology than character development."
0,clean up daily :(,"Absolutely disappointingcant pour out of carafe without a total mess on counter top talk about frustrating...I would rather wait a couple minutes longer for brewing than to have half of it on my counter ... never will i own a Bunn again ,,, mistake ..."
1,Excellent,What can I say? Rochelle has yet to disappoint me in the things she's written. I truly enjoyed the Hideway Saga and this after not reading a romance novel in over 20 years.
0,Not high enough,This seems to be well made but I have a 4 month old toy poodle. Weighs 3.2 pounds. She gets over this. Not good for any dog since they don't come too much smaller than mine
1,Nice hat for the price,"This is a nice mid level hat. For the 12 bucks I paid, I certainly am happy with the hat. It seems well made and should last me the entire baseball season (I play on an adult baseball team with the Indians as our mascot). If you are wearing it casually, I'm sure it would last several years."
0,Full of Rah Rah Rah,"Here's all he should have put in this book, ""You can do it"" because that's all I found. Very little in this book was helpful to me, maybe that's because I didn't want to read a book that only talked about how great the author was and how you can do it too. Mind you, he didn't actually tell you how, but he told you he was going to, up until the end of the book."
1,pet water dishes,This is a great product. I've purchased several of these in different sizes. I bought one of the larger ones which was a little too heavy for me to manage so I have multiple smaller ones. They're easy to use and go right into the dishwasher.
0,A little disappointed,"If you need help choosing and interviewing doctors, mid-wives, nannies, etc., there are many pages dedicated to helping you do so. However, I felt this did not apply to me personally. Also, there aren't enough blank spaces to take notes, just a few lines. I was expecting more space to take day-to-day notes. I ended up buying another journal after using this for a week."
1,Love it!,I love this sink and wish I had bought it years earlier. It was so easy to install. I would recommend this product to anyone who wants a single bowl sink. I also like how deep it is.
0,What on earth?,"I watched the preview and decided to rent this from iTunes. That was a big mistake... I remember thinking that the preview probably was the best part of the movie, and sure enough... You'd need an army of disbelief to suspend to make this even plausible.This could have been fun, if it had gone campy and not tried to take itself serious... but NO! And don't even get me started on the ending.I just don't know what they were thinking... This disaster movie is a disaster!"
1,Very good product.,My son soesn't like the variable nipple so I tried this one. He takes the bottle very well. Only problem is that it's hard to find at stores. So buy extras when found.
1,Learning to keep Sabbath Holy,A Great read for those looking for the reason why to remember the Sabbath. This book is a classic. The body of the book shares why and how God calls us to a time of rest. Heschel's daughter's introduction shares how sacred this time was for her family growing up and the various ways they celebrated the Sabbath. I purchased the book to read a Jewish perspective on Sabbath from a beloved Jewish scholar and I was not disappointed.
1,Great product for a great price,"Title said it all. I was able to install the Oxygen Sensor in less than 15 minutes and I'm not a mechanic. With the new sensor installed, I was able to reset my check engine light and passed CA smog test without any glitches."
1,Great Device,"The best money I have spent on my house. I put one in my second story laundry room and one next to my air handler, and I sleep much better now. The one in the laundry room has already alerted us to a splashing situation caused by an overfilled washer and I am sure it saved us more time and money than it cost."
0,Description Needs Editing,Instead of 10-inch should be 9 1/2 inch. Should state skillet has humorous oblong shape instead of tired looking circular shape.
1,fair quality for the price,"I found the aluminium frame a bit heavy and the handlebar not very confortable. Moreover I had to adjust brakes and shifts when I got it, and the instructions were not that usefull. Overall I think is a fair quality for the price."
0,Even their own techs couldn't make it work...,"Perhaps the worst computer product I've ever owned. Spent nearly four hours with a D-Link tech, a tech from my ISP and a tech from my satellite provider. None of them could get this thing to connect to my modem despite trying every imaginable configuration.Took it back to the store where I purchased it and traded it for an older and cheaper Linksys Wireles-G router that was up and running in 15 minutes.Normally I like D-Link products, but this one is junk. Avoid this router like the plague."
1,A fantastic guide to karate basics by the late Master Nakayama.,"The entire ""Best Karate"" series by Master Nakayama are must have books for all Shotokan Karate students. . This is the first book in the series and is a must read by anyone who desires to learn the vital basic techniques of Shotokan karate. Basic blocks, punches, strikes and kicks are shown as well as how to flow from one technique to another. As anyone who has studied Shotokan karate knows, the basics are practiced in every training session.This book in combination with actual training under an instructor, will make you better at karate. In conclusion, if you are serious about learning true Shotokan karate, you will want this book.Rating: 5 Stars. Joseph J. Truncale (Author: Shotokan Karate Self-Defense Techniques: Combat Karate for the Street)."
